{
  "$schema": "https://json-schema.org/draft/2020-12/schema",
  "title": "G-FShield 10-day campaign result",
  "type": "object",
  "required": [
    "campaign_id", "arm_id", "run_id", "seed", "candidate_id", "parent_id",
    "request_id", "stage", "algorithm", "feature_selector",
    "neighborhood_controller", "local_search", "classifier",
    "classifier_version", "classifier_parameters", "dataset_hash", "train_hash",
    "validation_hash", "test_hash", "selected_features", "subset_size",
    "dimensionality_reduction_percent", "validation_f1_macro",
    "validation_f1_weighted", "validation_precision_macro",
    "validation_precision_weighted", "validation_recall_macro",
    "validation_recall_weighted", "test_f1_macro", "test_f1_weighted",
    "test_precision_macro", "test_recall_macro", "accuracy", "class_labels",
    "validation_per_class_metrics", "validation_confusion_matrix",
    "test_per_class_metrics", "test_confusion_matrix", "candidate_time_ms",
    "classifier_time_ms", "run_elapsed_ms", "end_to_end_time_ms",
    "timestamp_utc", "monotonic_elapsed_ms", "candidate_count",
    "accepted_improvement_count", "process_cpu_percent",
    "container_cpu_percent", "host_cpu_percent", "process_rss_mb",
    "container_memory_mb", "host_memory_mb", "cpu_throttled_seconds",
    "disk_read_bytes", "disk_write_bytes", "network_rx_bytes",
    "network_tx_bytes", "kafka_lag", "restart_count", "stop_reason",
    "status", "error_code"
  ],
  "properties": {
    "campaign_id": {"type": "string"},
    "arm_id": {"type": "string"},
    "run_id": {"type": "string"},
    "seed": {"type": "integer"},
    "candidate_id": {"type": ["string", "null"]},
    "parent_id": {"type": ["string", "null"]},
    "request_id": {"type": ["string", "null"]},
    "stage": {"type": "string"},
    "algorithm": {"type": "string"},
    "feature_selector": {"type": ["string", "null"]},
    "neighborhood_controller": {"type": ["string", "null"]},
    "local_search": {"type": ["string", "null"]},
    "classifier": {"type": "string"},
    "classifier_version": {"type": "string"},
    "classifier_parameters": {"type": "object"},
    "dataset_hash": {"type": "string"},
    "train_hash": {"type": "string"},
    "validation_hash": {"type": "string"},
    "test_hash": {"type": "string"},
    "selected_features": {"type": "array", "items": {"type": ["integer", "string"]}},
    "subset_size": {"type": ["integer", "null"]},
    "dimensionality_reduction_percent": {"type": ["number", "null"]},
    "validation_f1_macro": {"type": ["number", "null"], "minimum": 0, "maximum": 1},
    "validation_f1_weighted": {"type": ["number", "null"], "minimum": 0, "maximum": 1},
    "validation_precision_macro": {"type": ["number", "null"], "minimum": 0, "maximum": 1},
    "validation_precision_weighted": {"type": ["number", "null"], "minimum": 0, "maximum": 1},
    "validation_recall_macro": {"type": ["number", "null"], "minimum": 0, "maximum": 1},
    "validation_recall_weighted": {"type": ["number", "null"], "minimum": 0, "maximum": 1},
    "test_f1_macro": {"type": ["number", "null"], "minimum": 0, "maximum": 1},
    "test_f1_weighted": {"type": ["number", "null"], "minimum": 0, "maximum": 1},
    "test_precision_macro": {"type": ["number", "null"], "minimum": 0, "maximum": 1},
    "test_recall_macro": {"type": ["number", "null"], "minimum": 0, "maximum": 1},
    "accuracy": {"type": ["number", "null"], "minimum": 0, "maximum": 1},
    "class_labels": {"type": "array", "items": {"type": "string"}},
    "validation_per_class_metrics": {
      "type": "object",
      "additionalProperties": {
        "type": "object",
        "required": ["f1", "precision", "recall"],
        "properties": {
          "f1": {"type": "number", "minimum": 0, "maximum": 1},
          "precision": {"type": "number", "minimum": 0, "maximum": 1},
          "recall": {"type": "number", "minimum": 0, "maximum": 1}
        },
        "additionalProperties": false
      }
    },
    "test_per_class_metrics": {
      "type": "object",
      "additionalProperties": {
        "type": "object",
        "required": ["f1", "precision", "recall"],
        "properties": {
          "f1": {"type": "number", "minimum": 0, "maximum": 1},
          "precision": {"type": "number", "minimum": 0, "maximum": 1},
          "recall": {"type": "number", "minimum": 0, "maximum": 1}
        },
        "additionalProperties": false
      }
    },
    "validation_confusion_matrix": {
      "type": "array",
      "items": {"type": "array", "items": {"type": "number", "minimum": 0}}
    },
    "test_confusion_matrix": {
      "type": "array",
      "items": {"type": "array", "items": {"type": "number", "minimum": 0}}
    },
    "candidate_time_ms": {"type": ["integer", "null"], "minimum": 0},
    "classifier_time_ms": {"type": ["integer", "null"], "minimum": 0},
    "run_elapsed_ms": {"type": ["integer", "null"], "minimum": 0},
    "end_to_end_time_ms": {"type": ["integer", "null"], "minimum": 0},
    "measurement_definition": {"type": ["string", "null"]},
    "measurement_start_offset_ms": {"type": ["integer", "null"], "minimum": 0},
    "measurement_started_utc": {"type": ["string", "null"], "format": "date-time"},
    "selection_deadline_utc": {"type": ["string", "null"], "format": "date-time"},
    "selection_duration_ms": {"type": ["integer", "null"], "minimum": 0},
    "selection_finished_utc": {"type": ["string", "null"], "format": "date-time"},
    "selection_elapsed_ms": {"type": ["integer", "null"], "minimum": 0},
    "cold_start_end_to_end_time_ms": {"type": ["integer", "null"], "minimum": 0},
    "timestamp_utc": {"type": "string", "format": "date-time"},
    "monotonic_elapsed_ms": {"type": "integer", "minimum": 0},
    "validation_time_to_target_ms": {"type": ["integer", "null"], "minimum": 0},
    "validation_time_to_targets_ms": {
      "type": "object",
      "additionalProperties": {"type": ["integer", "null"], "minimum": 0}
    },
    "candidate_count": {"type": ["integer", "null"], "minimum": 0},
    "accepted_improvement_count": {"type": ["integer", "null"], "minimum": 0},
    "process_cpu_percent": {"type": ["number", "null"]},
    "container_cpu_percent": {"type": ["number", "null"]},
    "host_cpu_percent": {"type": ["number", "null"]},
    "process_rss_mb": {"type": ["number", "null"]},
    "container_memory_mb": {"type": ["number", "null"]},
    "host_memory_mb": {"type": ["number", "null"]},
    "cpu_throttled_seconds": {"type": ["number", "null"]},
    "disk_read_bytes": {"type": ["integer", "null"]},
    "disk_write_bytes": {"type": ["integer", "null"]},
    "network_rx_bytes": {"type": ["integer", "null"]},
    "network_tx_bytes": {"type": ["integer", "null"]},
    "kafka_lag": {"type": ["integer", "null"]},
    "restart_count": {"type": ["integer", "null"]},
    "stop_reason": {"type": "string"},
    "status": {"enum": ["completed", "timeout", "timeout_forced", "failed", "oom", "cancelled"]},
    "error_code": {"type": ["string", "null"]}
  },
  "additionalProperties": false
}
